"Name","Title","Review","Stars","Date","Color","Verified Purchase","Sentiment Score"
"Elva Garcia","The BEST portable charger i have purchased","I have had this charger for 3 years and it ist still holding up perfectly. It takes a while to charge (I usually charge it overnight), however it is worth it. I have charged my dying phone up to 2.5 times. It will also continue charging when the portable charger is between 1-5%. The only ""complaint"" I have about it is that it is a bit heavy, but i guess it comes with the power it holds.","5.0","January 10, 2024","Black","Verified Purchase","10.468095238095238"
"PT","A good balance between size, weight, and capacity","Enough capacity for a Galaxy S23 or iPhone 14pro. Not too heavy to hold with the phone in my hand for hours on end. Not too big to fit in my hand with the phone while taking pictures. Had it for about a year and been to two trips, so not sure about its long term reliability. Highly recommended.","5.0","February 4, 2024","Black","Verified Purchase","11.175380952380952"
"Sabina Suther","Sustains battery life","Out of all the other portable chargers I have tried, this one is definetly the best. It does NOT take long to fully charge, and the battery sustains the whole day! We plug in multiple devices at once to use it fully. 10/10 recommend for anyone traveling/ living life to the fullest","5.0","January 20, 2024","Black","Verified Purchase","10.349666666666668"
"Kris R","Hold a charge for an incredible length of time","I purchased this charger last June to keep my phone charged while videoing my son’s baseball games. Worked well. Why am I coming back here in January of ‘24 to write this review? We recently lost power for 2 days due to heavy snow and cold. It was evening when it unexpectedly went out, so our phones weren’t close to fully charged. In fact, my son’s phone was at 9%. Not wanting to trudge out into a snow storm and severe cold, I teased that I’d grab this charger to try. I hadn’t touched it or charged it since the end of July, when his baseball season ended. I’d used it mind you, to record an entire game before packing it away. 5 months later, out of the closet, this battery pack was still over half charged!! It completely charged my teens phone, my phone (from 60%), and my iwatch! I was blown away. I would’ve thought for sure the battery would’ve been dead after sitting for 5 full months! It was a lifesaver in a pinch! Great quality!!","5.0","January 16, 2024","Black","Verified Purchase","10.319916666666666"
"Allison","Great for travel","I brought this for a domestic flight and put it in my purse, TSA had zero issue with it and the charge lasts a long time. I charged my iPhone fully with it on the plane, and the battery did not lose its charge after the trip. It came in handy during a power outage and it was able to charge my boyfriends phone, despite the battery pack not being charged for weeks","5.0","February 8, 2024","Black","Verified Purchase","10.523333333333333"
"Kindle Customer","Perfect","I needed a power source for my grandsons tablet. When it gets low, he has to string a cord so he can continue to play on it. This was the answer. I highly recommend it.","5.0","February 21, 2024","Black","Verified Purchase","9.977222222222222"
"Jason","My favorite power bank","I have a bunch of these and I always keep them charged. This is a light-weight and stylish unit that can recharge your phone several times. I haven't counted but I would guess about 3 times starting from zero. It might be more. I put it in a case with the charging cable (I bought a longer one than the one that comes from the unit) and a wall usb charger and take these with me on airline trips, road trips, any place where I know I'll be taking a bunch of photos and videos... It also comes with a little pouch which is quite nice. By the way, it's a smaller than my phone and thus fits in my pocket. I looked over all the similar Power Banks and for this price range (inexpensive), you get much more for your money than any others I saw. There are Power Banks that might charge a phone 5 times over, but they are bigger and bulkier and I'd just rather carry around 2 of these ones if I really had that much need.","5.0","January 21, 2024","Black","Verified Purchase","10.465416666666666"
"HunterBoozer","Perfect Slim Size Power Bank","I love the size (slightly shorter than my iPhone 12 Plus) and much thinner. I love that there is a flashlight o. It as well. It will be great when out hiking and the phone dies. Can charge the phone and see where I’m going. Love the paw print signal indicator on it as I’m usually walking my dog.","5.0","February 11, 2024","Black","Verified Purchase","10.590166666666667"
"Kraig Kaiser","Nice but lacks the rated power","I purchased two of these batteries. The size is very nice, the padded bag is nice too. It feels quality and should work great for the heated vest I purchased it to power. I did an ah test on one of the batteries, like I do for ALL lithium batteries. The test showed that these batteries DO NOT have the rated power in them. My test produced 6.07 ah of power. These are rated for 10,000 mah which is 10 ah's. These are really rated at 6,000 mah. The price is nice but it you want full power then I suggest going with a different brand. I may return these and get ones that hopefully test out to their rated power. This is something we consumers need to watch. We can be duped so easily when it comes to lithium batteries. I make sure all of my lithium batteries have their full capacity. These are the first batteries I've tested that do not meet the advertised rating.","4.0","December 29, 2023","Black","Verified Purchase","8.760170068027211"
"Ted Moyer","I love these! I have bought like 5 because the kids and my hubby steal them!","I do not know how I would live without these. I generally keep two with me at all times, as I never know when a kid or a friend will need one. I've reordered these several times, and I've had my first one for over a year and a half.","5.0","February 13, 2024","Black","Verified Purchase","9.955666666666666"
"NikkiFlash","Power Punch","This little guys packs a wallop. It’s small and sturdy (which helps if you drip things like I do). It recharges itself quickly and then is invaluable as I travel. I love how light weight it is. The little dog paws light up as it’s charging which is just a cute little added touch!","5.0","February 26, 2024","Black","Verified Purchase","9.737647058823528"
"Doug S.","Worked as advertised","On a trip to Las Vegas, used the unit to quickly charge 3 different phones. Still had power left over if we had needed it. Have two that are charged all the time.","5.0","February 20, 2024","Red","Verified Purchase","9.928076923076922"
"Random Review Guy","Great compact charger","Perfect size. Love the light. Double click to turn on or off. The paw print is a really neat feature to tell the power remaining or charge left. Look forward to testing this out.","5.0","February 24, 2024","Black","Verified Purchase","10.939666666666666"
"kelly","3rd purchase!","I bought one for myself and used for months, then bought my son one for Christmas. This past week I left mine with a friend at the hospital and bought another. It is that good!","5.0","February 22, 2024","Black","Verified Purchase","10.197692307692307"
"Tiffany","Bought a second one…","Bought a second one because it’s a popular product in my house. It works great, is nice and thin, and has a cute case to put it in when you’re not using it! Highly recommend!","5.0","March 5, 2024","Black","Verified Purchase","10.448846153846153"
